0,https://blog.naver.com/choi170333/222473436230,"_님 [순간이 모여 인생] 블로거의 일상을 기록 육아.애견.게임.맛집.여행 ㄴ사진도용 절대 금지 ㄴ글,사진 공유시 출처필수 프로필 ^ [농심 백산수] 안전한생수! 내추럴 미네랄워터 아기분유물로 사용해요 #농심 #백산수 #백산수330 #아기물 #내추럴미네랄생수 #아기생수 #천연미네랄 #아이물 #천지차이백산수 #아기분유물 #아이분유타는물추천 #분유잘녹는물 농심 백산수 아기분유물로 사용해요 ​ 아기 분유물로 마시기 적합한 생수 농심 백산수를 준비했어요 백산수 수원지는 백두산 해발 670ml 청정 원시림 보호구역으로 사람의 발길이 닿지 않는 깨끗한 곳으로 화산암반층이 오랜 세월 자연 정화한 물이라 아기에게 믿고 먹일 수 있어요 ​ ​ 한 손에 쏙 들어오는 330ml 가방에 넣고 다니기 좋은 사이즈로 외출할 때 가볍게 가지고 다니기 좋아요 아기랑 외출이나 여행을 가면 분유물을 챙겨야하는데 백산수 생수를 챙기면 딱 좋을것 같아요 ​ ​ 아기가 먹는 물이다 보니 성분은 물론 품질도 꼼꼼하게 살펴보게 되는데요 백산수는 취수부터 생산,물류,출고까지 전 과정에서 오염의 원천을 차단, 엄격한 글로벌 품질관리를 거쳐 최상의 품질을 유지해 아기도 엄마도 안심하고 마실 수 있어요 ​  백산수는 엄마 양수와 가장 닮은 물인데요 백산수는 pH 6.9~7.3을 유지해 태아의 영양 공급원인 양수와 유사한 pH를 지녔고 칼슘 함량이 낮아 분유 용해성이 뛰어나요 ​ ​ 천연 미네랄이 풍부한 백산수! 건강에 유익한 천연 미네랄 성분이 골고루 들어 있어 온 가족이 마시기 좋은 우리가족 생수예요 몸에 좋은 실리카가 풍부하고 마그네슘과 칼슘 비율이 1.05로 좋은 물로 분류돼요 ​ ​ 분유포트에 백산수를 넣어주고 끓여줍니다 백산수는 끓여도 성분이 유지가 되서 물을 100도로 끓였다가 45도로 식혀서 분유물로 사용하기 적합해요 ​ ​ 끓여도 미네랄 성분이 유지되는 백산수 맛도 좋고 분유가 잘 녹아서 아기물로 사용하기 아주 좋았어요 젖을 먹는 아기는 생후 6개월이전 1회 30~50ml를 넘지 않게 섭취하고 이유식을 먹은 아기는 미지근하게 해서 주는게 좋아요 ​ ​ 분리수거도 어렵지 않아요 이지 오픈으로 라벨을 떼어주고 페트병을 구겨서 분리 배출 해주면 끝 아기 분유 타는 물 추천! 이제 아기가 마시는 물 성분도 꼼꼼하게 살펴보고 주시길 바라요 우리 가족 안심 생수 백산수 추천합니다 😆 ​ ​ [맘스 다이어리 체험단으로 선정되어 농심 백산수로부터 제품을 지원받아 작성한 후기입니다.]"
1,https://blog.naver.com/happy_hworld/222208123790,"_님 뷰티와 패션 그리고 귀여운 꼬몽이와 함께하는 일상 :) 프로필 ^ 링티 제품으로 수분보충 해주고 백산수 무료쿠폰도 받고 시국이 시국이라 외출도 거의 하지 않다보니 집에서 뭔가를 챙겨 먹기도 귀찮고 날씨는 또 추우니 보일러와 히터를 팡팡 틀어 건조함에 시달리던 요즘 수분보충을 위해 링티를 마셔보게 되었다. ​ TV광고로 접하면서 너무나 궁금했던 제품이었는데 요즘같이 보습관리에 신경이 쓰이던 때에 만나보게 되어서 더 반갑기도 했다. ​ ​ ​ 평소 물을 많이 그리고 자주 마시려고 노력하긴 하지만 집에만 있다보면 그것도 귀찮음,, ​ 나뿐만 아니라 많은 분들이 집에 있으면 아무것도 하기 싫고 뭔가 챙겨먹기도 귀찮으시리라 생각하는데 ​ 그럴때 노트북 옆에 링티 하나 타두고 홀짝홀짝 마시면 수분보충도 되고 건조함에도 도움이 되는것 같아서 요즘 매일 마셔주고 있다. ​ ​ ​ 나는 링티X백산수 콜라보 제품으로 마셔보게 되었는데 아무래도 물에 타마시는 거다보니 좋은 물과 함께 한 콜라보레이션이 뭔가 제대로다 싶었다. ​ 주방에 정수기를 둘 공간이 부족해서 생수를 사마시는 편인데 내가 눈여겨 보던 백산수와의 콜라보라니 덕분에 좋은 물 경험해볼 기회가 생긴 것 같음 ㅎㅎ ​ ​ ​ 링티를 구매한 분들에게 백산수 500ml, 20개입 1박스를 받을수 있는 무료쿠폰이 함께 들어있었는데 ​ 백산수 모바일 어플을 다운받은 후 회원가입 후 무료쿠폰을 사용하면 되니 간편하게 이용할 수 있을것 같았다. ​ ​ ​ 마그네슘이나 칼슘 그리고 천연 실리카까지 건강에 도움이 될 수 있는 천연 미네랄이 살아있는 좋은 물 백산수 ​ ​ ​ 백두산 청정원시림 보호구역 내 위치하고 있는 내두천이라는 곳에서 공기접촉 없이 무인시스템으로 만들어지는 백산수 ​ ​ ​ 링티 + 사각보틀 / 가격 33,000원 링티 X 백산수 좋은 물로 수분충전 링티 한 포와 백산수 500ml 하나면 수분 섭취를 언제 어디서나 간편하게 할 수가 있는데 구입시 물병까지 함께 받아볼 수 있었다. ​ ​ ​ 군의관들이 만든 제품이다보니 뭔가 더 믿음이 가는 것 같았고, 커피 대신 챙겨 마시기도 좋고 건조한 계절 유난히 목도 마르고 건조함이 느껴질 때 한 포 씩 챙겨주면 되니 더 만족스러운 느낌? ​ ​ ​ 좋은 물 백산수 500ml에 링티 한 포 타서 수분보충을 해주면 된다. ​ 레몬맛과 복숭아맛 두 종류의 맛이 있어서 원하는 맛으로 골라 섭취하면 좋을듯 ㅎㅎ ​ ​ ​ 링티 레몬맛의 경우 평소 접하던 이온음료보다 살짝 더 달달하고 맛있게 먹을수 있어서 내 입맛에도 딱 알맞았다. ​ ​ ​ QR코드 스캔하면 백산수 할인 쿠폰을 받을수 있으니 참고해주시면 좋을 듯 >< ​ ​ ​ 아무래도 링티를 처음 접한거라 궁금했던 점이 많았는데 제품내에 Q&A가 들어있어서 링티에 대한 궁금증을 해결할 수가 있었다. ​ 링티는 하루 한 포 ~ 2 포를 권장량으로 권유하고 있었고 뜨거운 물 보다는 찬 물에 먹길 권장한다고 했다. ​ 또한 500ml 물에서 가장 적절하게 농도와 삼투압을 맞추어둔 제품이다보니 딱 백산수 500ml에 타서 마시면 찰떡이었다. ​ ​ ​ 농도와 삼투압이 가장 중요한 제품이다보니 식사 30분후 섭취하는 게 좋다고 한다. ​ 식사 중 마시는 것 보다는 식후 커피나 달달한 음료가 땡길 때 그보다는 수분보충을 위해 링티를 마셔주면 좋을것 같음 ㅎㅎ ​ 수분과 전해질의 비율에 집중하는 이유가 소장벽에서 수분수송체가 물을 잘 흡수있게 하는 포인트이기 때문이고 이렇게 비율을 맞춰 입으로 마시는 수액 역할을 할 수 있도록 해주기 때문에 강도 높은 훈련 후 많은 땀을 흘리는 병사들을 보고 수분충전음료로 군의관 출신 의사가 만든 링티의 특징! ​ (+ 편의점에서도 경구수액을 구입할 수 있는 해외와 달리, 국내에선 경구수액이 의약품으로 분류되어있기 때문에 국내에서도 누구나 쉽게 만나볼 수 있도록 이러한 전해질 비율을 중점으로 두었기 때문에 링티는 '일반음료'로 출시된 상품이라는 점!) ​ ​ ​ 특전사 군의관출신의 의사가 만든 제품이다보니 뭔가 믿음도 가고, 선물용으로도 좋을것 같았다. ​ 요즘은 지인들 챙길 때에도 온라인을 통해 챙겨야 하기때문에 수분과 비타민까지 함께 챙겨주는 링티를 선물해주기도 좋을것 같았고 ​ 환절기나 추운 날씨에 건강관리를 하려면 규칙적인 생활과 수분보충이 기본이기 때문에 체내 수분 흡수 효과가 실험으로 검증된 제품을 마시는 걸 추천해드리고 싶다. ​ ​ ​ 한 상자에 10포가 들어있고 링티 공식몰에서 백산수 콜라보레이션 한정판 제품 10박스를 구입하면 온라인 최저가, 52% 반값 가격으로 한정판매가 된다고 하니 여러박스 구입하실 분들은 완전 이득일 듯! ​ ​ ​ 가위나 칼이 없이도 쉽게 뜯을 수 있는 이지컷 제품이기 때문에 정말 언제 어디서나 섭취하기가 좋았고 ​ 가루로 된 분말이 찬 물에도 잘 녹기 때문에 불편함 없이 섭취가 가능했다. ​ ​ ​ 좋은 물 백산수 500ml에 링티 한 포 타주면 수분보충을 쉽게 할 수가 있어서 건조한 요즘 날씨에 정말 좋다. ​ ​ 5분 이상 소요될 수 있으며, 영상의 길이에 따라 소요 시간은 달라집니다.   SKIP 사각 보틀에 500ml 생수 넣어주고, 링티 한 포 넣어서 흔들어 섞어주기만 하면 된다. ​ 좋은 물과 함께 마시니 더 만족스러움 ㅋㅋ ​ ​ ​ 물에 섞는다고 해서 컬러가 따로 변하진 않았고 이온음료 같은 컬러느낌? ​ ​ ​ 과하게 달달하지 않으면서 은은하게 레몬맛이 느껴지고 이온음료 마시는것 처럼 입안이 텁텁한 느낌도 거의 없어서 개인적으로 맛도 마음에 들었다. ​ ​ ​ 요즘은 밖에서 뭘 마시기도 부담스럽다보니 더 물을 챙겨먹지 않게 되기 때문에 가방에 한 포 넣고 다니면 언제 어디서나 수분보충해주기 좋음 ㅎㅎ ​ ​ ​ 운동을 많이 하거나 추운 날씨에 화장실만 자주 가는 분들에게도 몸에 수분을 채워줘야 하니 링티 추천을 드리고 싶당..! ​ 링티 맛도 좋다구요 :)~ ​ ​ ​ 링티는 카페인 걱정도 없으니 밤에도 마시기 좋고, 춥고 건조한 요즘같은 날씨엔 매일 챙겨먹으면 뭔가 나를 위한 건강관리도 하는 느낌이 들기 때문에 꼭 드셔보셨으면 좋겠당 ㅎㅎ ​ 회원가입과 카톡플친 적립금과 구매&리뷰 적립금까지 최대 7,480원을 받을수 있다고 하니 링티X농심 백산수의 혜택도 꼭 받아보시길! ​ ​ ​ ​ ​ ​ ​ ​ ​ ​ ​ ​ ​ 본 포스팅은 (주)링티로부터 제품 및 원고료를 제공받아 솔직하게 작성되었습니다. ​ ​ ​ ​ ​ ​ ​ ​"
2,https://blog.naver.com/theboni/222231042789,"_님   ​ 울집 랑이도 꼬맹이도 집콕중이다 보니 평소보다 집밥 해먹는 횟수가 늘었어요. 거리두기로 대부분 집에서 보내는 데다 추운 날씨로 인해 따뜻한 차도 자주 마시고 매일 국물요리도 필수로 준비하다 보니 확실히 생수 사용량도 배가 되더라고요. ​ ​ ​ 예전 같으면 랑이랑 데이트도 할 겸 주말마다 장보면서 함께 사 왔을 텐데 시기가 시기인지라 요즘은 온라인 이용중! 특히 무거운 생수는 배달이 필수라서 백산수 주문앱을 활용하고 있어요ㅎ  ​    ​ 편리한 생수 배달 서비스를 이용하려면 플레이 스토어에서 백산수 주문배송 앱을 다운로드한 후 휘리릭 설치하면 끄읏~! ​ ​  생수는 워낙 무게가 무겁기도 하고 항상 구비해두어야 하는 소모품이라 집앞까지 간편하게 배송해주는 가정 배송 서비스가 좋은데요 . 백산수 앱은 일반 택배가 아닌 인근 지역 대리점에서 집까지 직접 배송해주는 시스템이라 흡족!  ​메인페이지 주문 버튼을 클릭하면 비회원도 쉽게 이용할 수 있어요. ​ ​ ​ 종류도 집에서 음용 및 요리 하기 좋은 2L, 여행이나 캠핑갈 때 구비하면 딱인 1L, 외출이나 나들이갈 때 챙겨가기 좋은 500ml , 아이들 등교할 때 휴대하기 좋은 330ml까지  다양한 용량을 만날 수 있어 엄지척~! ​ 저는 1월 이벤트로 4+1행사를 적용받아서 보다 알뜰하게 구매했어요. 지금은 할인기간이 끝났지만 이런 이벤트가 자주 있다고 하니 잘 이용해야겠어요.    ​구매금액의 5% 마일리지 적립 혜택도 가능! ​정기배송 서비스를 이용시 원하는 날에 배송과 마일리지도 무려 15% 적립해준답니다. ​ ​ ​ 집 앞까지 배송해주는 것도 마음에 들지만 생수는 매일 일정량을 마셔야 하는 만큼 어떤 물을 선택하느냐도 중요하다고 해서 화산암반용천수 백산수를 마시고 있는데요. 직접 사러 가지 않아도 되니 넘나 편해요ㅎ  ​ 백산수는 41km에 달하는 화산암반층이 오랜 기간 거르고 거른 물이 청정원시림 자연보호구역에서 솟아오르는 화산암반용천수로 백두산의 힘과 생명력을 담은 것이 특징이에요. 지하에 스며든 물을 인위적으로 끌어올리는 일반 생수와 시스템부터 달라 마음에 쏘옥ㅎ  ​ 몸에 좋은 실리카 함량도 높다는 점! 잊지 마세요! 실리카는 현무암층에 많이 함유되어 있는데요. 백두산은 세계 최대 현무암지대로 손꼽히는 만큼 물속에 실리카 성분이 많이 들어있다고 해요. ​ ​ ​ 2003년 WHO 학회에서 먹는 물의 필수 영양성분 19가지 중 하나로 실리카가 선정되었는데요. 성인 기준 하루 권장 실리카 햠량이 80mg으로 백산수 2L 1병이면 권장량 섭취가 가능해서 물 마시면서 자연스럽게 섭취할 수 있겠더라고요. ​ ​ ​ 실리카 성분이 함유되어 있다고 해서 요즘 백산수 마시면서 수분 보충하는데요. 일할 때마다 즐겨 마셨던 커피 대신에  생수를 마시니 내 몸을 더 아껴주는 기분입니다.   ​ ​  ​ 2L는 넉넉해서 요리할 때 사용해도 좋은데요. 집에서 편하게 생수배달을 받게 되니 부담 없이 국물요리에 활용하게 되더라는ㅎ ​ ​   매일 앉아서 공부하는 아드님도 백산수 500ml를 챙겨주고 있어요. ​ ​  ​ 휴대용으로 좋은 330ml와 500ml는 한 손에 쏙 들어오는 사이즈라서 가방 안에 넣고 다니면서 수시로 수분 충전하기도 좋아요. ​ ​ ​ 활력 있는 생활을 위해 홈트하고 난 후 갈증을 풀어주는 물 한잔이 필수잖아요. 땀 흘리고 난 후 시원하게 마시면 갈증도 해소되고 스트레스도 싹 사라져요~ ​ ​ ​ ​ 요즘 같을 때는 면역력을 키워주는 건강식품도 자주 챙겨 먹게 되잖아요. 저도 매일 홍삼차를 마시고 있는데요. 향긋한 티타임 가질 때도 딱이에요ㅎ ​ ​작은 습관이 생활의 질을 좌우하죠. 이제 백산수 앱으로 무거운 생수 집 앞까지 편하게 배송 받으세요! 농심으로부터 제품과 고료를 지원받아 작성되었습니다 ​  블로그가 어쩜이래?     따라하니 맛있는데?     그블로그 어디더라?     이런분들 많으시죠?      이웃추가 해보세요:) 프로필 ^ Today 9,929 Total 68,804,090"
3,https://blog.naver.com/jagaja1124/222406453283,"_님 전지현 생수 백산수, 무라벨로 환경까지! 밖에서 외부 활동을 조금 하면 땀이 배어나오는 여름이 되었습니다. 가급적 시원한 곳에서 그리고 수분 보충을 충분히 해줘야하는 요즘인데요. 그러기에 요즘 저는 커피 대신 500ml 생수병을 하나 챙겨 조금씩 그리고 자주 마셔주며 몸 속 수분 밸런스를 고려해주고 있습니다. ​ ​ ​ 덥고 땀나는 계절이지만 이와는 상충적으로 스포츠의 계절이기도 합니다. 조금은 외부 활동이 조심스럽기도 하지만 이 시기가 아니면 또 다음 여름을 기다려야 하기에 지인분들과 야외에서 재미있는 시간을 보내기도 합니다. ​ ​ ​ 또 겨우내 불어난 체중, 가뜩이나 최근 갑작스러운 교통사고 덕분에 허리 통증이 생겨 의사 선생님께 조언을 구했는데요. ​ 이 참에 약간 체중 감량을 해보시는 것도 도움이 될 것 같다고 해서 무리가 되지 않는 선에서 유산소 운동 그리고 스트레칭을 통해 건강한 몸 가꾸기를 시작했습니다. ​ ​ ​ 정수기가 있지만 하루 종일 들고 다니며 마시기에 그리고 차에 두고 마시기엔 역시 500ml 생수가 유용합니다. ​ '백두산 백산수!' 로고송 다들 한번쯤은 들어보셨을텐데요. 은근 물 맛에 민감한 저의 선택은 농심 백산수, 깔끔한 뒷맛이 상쾌함을 더하는 느낌입니다. ​ ​ ​ 요즘 달라진 분리수거 방법, 다들 번거로움을 많이 느끼시죠? ​ 투명 플라스틱의 경우 라벨을 떼고 뚜껑도 열고 이런 저런 손이 더 가는 경우가 생겼는데요. ​ 지켜야하는 환경을 생각한 일이니 저 역시도 따르고 지키지만 솔찍히 조금 귀찮은 것이 사실이긴 합니다. ​ ​ ​ 백산수 라떼, 들어보셨나요? '백산수 라벨을 떼다.' 의 줄임말이라고 하는데요. ​ 전지현 생수로도 유명한 물, 그래서인지 그 이미지와 어울리게 상큼하고 발랄한 느낌으로 기존의 라벨을 제거 ​ 보다 맑고 투명한 느낌으로 우리 곁을 찾아왔습니다. ​ ​ ​ 대신에 양각 로고로 존재감은 뿜뿜 환경을 생각하며 소비자의 번거로움은 개선한 노력 이런 패키징 구성에 조금은 초기 비용이 증가했을 듯 싶지만 과감한 결정 칭찬합니다! ​ ​ ​ 41km 백두산 화산 암반층에 의해 오랜 세월 자연스럽게 걸러진 물 백두산의 청정원시림 보호구역에서 시작된 물이기에 시작부터 다른 맑음의 차이 직접 마셔보면 바로 느끼실 수 있는데요. ​ 스스로 솟아오르는 화산암반용천수의 생명력까지 느껴지는 투명함 그래서 저는 운동할 때에 꼭 챙기는 생수로 애용합니다. ​ ​  운동할 때뿐 아니라 항상 가방에 챙기며 아이들과의 외출에도 좋은 물로 목마름을 달래주는데요. ​ 특히나 저희 아이들은 물을 자주 찾아 좋은 물과 함께 하는 외출 준비, 중요한 부분 중 하나입니다. ​ 농심 백산수 공식 인스타그램에서는 전지현과 함께 하는 바른 물습관 챌린지 소식도 접할 수 있는데요. ​ 운동 전과 후 그리고 운동 중간에 수분 보충을 위한 루틴 전지현님의 설명과 함께 들어볼 수 있어 참고하면 유용한 지식이 되리라 생각합니다. ​ 21일 부터는 일상에서 실천할 수 있는 바른 물습관 챌린지가 진행되고 있네요. ​ ​ ​ 1. 2L를 의미하는 손가락 모양과 함께 사진 촬영 2. #천지차이백산수 #백산수 #바른물습관챌린지 #백산수2L마시기 의 필수 해시태그와 함께 전체공개로 업로드 3. 백산수 공식 인스타그램 팔로우, 공식 앱 다운로드 ​ 이 세 단계를 거치면 참여가 된다고 합니다. ​ ​ ​ 승리의 V ​ 하루 2L정도 마시기에 도전하는 바른 물습관을 실천하는 모습, 숫자 2가 연상되는 손가락 V와 함께 인증, 챌린지에 도전해 행운까지 잡아보시기 바랍니다. ​ ​ ​ 바른 물습관 챌린지 일상편 참여기간 : 6월 21일 ~ 7월 20일 ​ 참여방법 ① 백산수 하루 2L 마시기 도전, 2L를 의미하는 손가락 '✌' 모습 촬영 ② 인증한 사진 또는 영상을 개인 인스타그램 피드에 필수해시태그와 함께 업로드 #천지차이백산수 #백산수 #바른물습관챌린지 #백산수2L마시기 ③ 백산수와 인친 & 앱친이 되어주면 참여 완료 ​ 챌리지 경품 청호나이스 미니 건조기(1명) 백산수 앱 1개월 구독권 (100명) - 3만 포인트 ​ 발표: 8/3 백산수 인스타그램 생활 속의 갈증 해결, 환경까지 생각하는 무라벨 백산수와 함께 해보세요! ​ ​ 해당 브랜드로부터 소정의 원고료를 제공받아 작성한 컨텐츠입니다. 문의메일 :  jagaja1124@naver.com 카카오톡 :  chdh1314  여행 / 육아 / 자동차  / IT / 스포츠 / 기타 리뷰 프로필 ^"
4,https://blog.naver.com/anger51515/222475780546,"_님 농심 백산수, 내추럴 미네랄워터 온가족이 먹는 안전한생수 만족 안녕하세요 도담맘입니다 오늘은 농심 백산수, 백산수 330에 대한 후기를 전해드릴게요 ​ 천연미네랄, 분유가 잘 녹는 농심 백산수 도담이가 분유를 떼고 나서는 물을 끓여서 먹이는 일은 거의 없어지고 아기물로 생수를 사먹이고 있는 요즘, 생수의 종류도 많고 생수병의 사이즈도 천차만별 매번 500ml를 주로 애용하다가 이번에는 농심 백산수, 백산수 330로 선택! ​ ​ 내추럴 미네랄생수 농심 백산수는 인체에 유익한 특수 미네랄 성분인 실리카가 많이 함유된 물로, 실리카 함량이 높을 수록 좋은 물이라고 하더라고요 ​ 혹 모르고 계셨다면, 아기 생수를 구입하기 전에 실리카가 많이 함유되어있는 물인지 확인하세요 :) ​ ​ 그 뿐만아니라 천지차이 백산수는 경도 29인 연수로 목넘김이 부드럽고 물맛이 좋아서 어른은 물론 아이가 마시기에 목넘김이 딱! ( * 수돗물의 경우 경도 65-75 ) ​ ​ 농심 백산수는 다양한 사이즈로 출시되고 있더라구요 백산수 330ml의 경우는 어느 가방이든 쏙 들어가는 사이즈라서 아기 외출가방에 함께 넣어서 외출해보니 부피차지도 많이 안해서 정말 좋더라구요 그래서인지 자꾸만 손이가요 손이가 ​ ​ 아기생수 백산수의 라벨은 아래의 사진과 같이 쉽게 뜯을 수 있게금 디자인 되어 있어서 다 마시고 난 후 분리수거하기도 편해요 환경까지 생각하는 센스 ​ ​ 그리고 농심 백산수는 천연 미네랄 밸런스가 좋은데 끓여도 그 성분이 유지돼 끓였다가 45도로 식혀 사용하는 아기분유물로 안성맞춤이라고 해요 도담이 분유시절에 백산수를 알았어야했는데... 출처 앙쥬 ​ 또한 어른들이 마시는 티백 뿐만아니라 분유, 유산균도 잘 녹아서 도담이가 마시는 백산수에 유산균을 종종 타서 주고 있답니다 :) ​ ​ 분유잘녹는물 백산수 330은 사이즈가 아담해서 외출용으로 부담이 없어서 더 만족스럽네요 ​ 성분은 물론 수원지까지 깨끗하니 믿고 먹을 수 있는 농심 백산수, 이제는 도담이 뿐만 아니라 온가족이 다 같이 마시는 가족 건강 물로 자리 잡았답니다 천지차이 백산수로 가득찬 냉장고를 보니 마음이 뿌듯뿌듯하네염 ​ ​ ​ ​ ​ ​ 체험단으로 선정되어 농심 백산수로부터 제품을 지원받아 작성한 후기입니다 ​ ​ ​ ​ ​ ​ ​ ​ ​ ​ ​ ​ ​ ​ ​ ​ 국민건강보험공단등록센터 /청각학 교수 전문 청능사그룹 프로필 ^"
